{
  "schema": "qube.router_corpus.v1",
  "version": 2,
  "description": "Baseline router evaluation corpus (125 prompts incl. retrieval-tempting GK)",
  "cases": [
    {
      "id": "gk_001",
      "prompt": "Why is the sky blue?",
      "expected_route": "none",
      "category": "general_knowledge",
      "notes": "Rayleigh scattering"
    },
    {
      "id": "gk_002",
      "prompt": "How does photosynthesis work?",
      "expected_route": "none",
      "category": "general_knowledge",
      "notes": "plants convert light"
    },
    {
      "id": "gk_003",
      "prompt": "What is the speed of light in a vacuum?",
      "expected_route": "none",
      "category": "general_knowledge",
      "notes": "physics constant"
    },
    {
      "id": "gk_004",
      "prompt": "Explain how a transformer neural network works.",
      "expected_route": "none",
      "category": "general_knowledge",
      "notes": "ML architecture"
    },
    {
      "id": "gk_005",
      "prompt": "Write me a haiku about the sea.",
      "expected_route": "none",
      "category": "general_knowledge",
      "notes": "creative, no retrieval"
    },
    {
      "id": "gk_006",
      "prompt": "Give me a Python snippet to reverse a string.",
      "expected_route": "none",
      "category": "general_knowledge",
      "notes": "coding task"
    },
    {
      "id": "gk_007",
      "prompt": "Translate 'good morning' into Spanish.",
      "expected_route": "none",
      "category": "general_knowledge",
      "notes": "translation"
    },
    {
      "id": "gk_008",
      "prompt": "What's the capital of Australia?",
      "expected_route": "none",
      "category": "general_knowledge",
      "notes": "factual geography"
    },
    {
      "id": "gk_009",
      "prompt": "Summarize the plot of Macbeth in two sentences.",
      "expected_route": "none",
      "category": "general_knowledge",
      "notes": "literature"
    },
    {
      "id": "gk_010",
      "prompt": "How do I convert 32 degrees Fahrenheit to Celsius?",
      "expected_route": "none",
      "category": "general_knowledge",
      "notes": "unit conversion"
    },
    {
      "id": "gk_011",
      "prompt": "What causes seasons on Earth?",
      "expected_route": "none",
      "category": "general_knowledge",
      "notes": "axial tilt"
    },
    {
      "id": "gk_012",
      "prompt": "Define entropy in thermodynamics.",
      "expected_route": "none",
      "category": "general_knowledge",
      "notes": "physics definition"
    },
    {
      "id": "gk_013",
      "prompt": "What is a binary search algorithm?",
      "expected_route": "none",
      "category": "general_knowledge",
      "notes": "CS concept"
    },
    {
      "id": "gk_014",
      "prompt": "How many planets are in the solar system?",
      "expected_route": "none",
      "category": "general_knowledge",
      "notes": "astronomy"
    },
    {
      "id": "gk_015",
      "prompt": "What is the difference between HTTP and HTTPS?",
      "expected_route": "none",
      "category": "general_knowledge",
      "notes": "networking"
    },
    {
      "id": "gk_016",
      "prompt": "Explain recursion with a simple example.",
      "expected_route": "none",
      "category": "general_knowledge",
      "notes": "CS teaching"
    },
    {
      "id": "gk_017",
      "prompt": "What is the chemical formula for water?",
      "expected_route": "none",
      "category": "general_knowledge",
      "notes": "chemistry"
    },
    {
      "id": "gk_018",
      "prompt": "How do vaccines train the immune system?",
      "expected_route": "none",
      "category": "general_knowledge",
      "notes": "biology"
    },
    {
      "id": "gk_019",
      "prompt": "What does GDP measure?",
      "expected_route": "none",
      "category": "general_knowledge",
      "notes": "economics"
    },
    {
      "id": "gk_020",
      "prompt": "Compare SQL and NoSQL databases briefly.",
      "expected_route": "none",
      "category": "general_knowledge",
      "notes": "tech comparison"
    },
    {
      "id": "mem_001",
      "prompt": "What do you remember about my coffee preference?",
      "expected_route": "memory",
      "category": "memory_recall",
      "notes": "preference recall",
      "flags": {
        "memory_type": "preference"
      }
    },
    {
      "id": "mem_002",
      "prompt": "Do I like metric or imperial units?",
      "expected_route": "memory",
      "category": "memory_recall",
      "notes": "settings recall",
      "flags": {
        "memory_type": "preference"
      }
    },
    {
      "id": "mem_003",
      "prompt": "What is my dog's name?",
      "expected_route": "memory",
      "category": "memory_recall",
      "notes": "personal fact",
      "flags": {
        "memory_type": "personal_fact"
      }
    },
    {
      "id": "mem_004",
      "prompt": "Remind me what timezone I told you I live in.",
      "expected_route": "memory",
      "category": "memory_recall",
      "notes": "timezone",
      "flags": {
        "memory_type": "preference"
      }
    },
    {
      "id": "mem_005",
      "prompt": "What did I say my favorite editor was?",
      "expected_route": "memory",
      "category": "memory_recall",
      "notes": "tool preference",
      "flags": {
        "memory_type": "preference"
      }
    },
    {
      "id": "mem_006",
      "prompt": "Do you remember my wife's name?",
      "expected_route": "memory",
      "category": "memory_recall",
      "notes": "family fact",
      "flags": {
        "memory_type": "relationship"
      }
    },
    {
      "id": "mem_007",
      "prompt": "What allergies did I mention?",
      "expected_route": "memory",
      "category": "memory_recall",
      "notes": "health preference",
      "flags": {
        "memory_type": "personal_fact"
      }
    },
    {
      "id": "mem_008",
      "prompt": "Recall my usual bedtime.",
      "expected_route": "memory",
      "category": "memory_recall",
      "notes": "habit",
      "flags": {
        "memory_type": "preference"
      }
    },
    {
      "id": "mem_009",
      "prompt": "What am I allergic to?",
      "expected_route": "memory",
      "category": "memory_recall",
      "notes": "memory substring trigger",
      "flags": {
        "memory_type": "personal_fact"
      }
    },
    {
      "id": "mem_010",
      "prompt": "Tell me about my brother Mark.",
      "expected_route": "hybrid",
      "category": "memory_recall",
      "notes": "recall fusion candidate",
      "flags": {
        "memory_type": "relationship"
      }
    },
    {
      "id": "mem_011",
      "prompt": "Who is Dr. Evelyn according to what you know about me?",
      "expected_route": "hybrid",
      "category": "memory_recall",
      "notes": "hybrid recall",
      "flags": {
        "memory_type": "relationship"
      }
    },
    {
      "id": "mem_012",
      "prompt": "Remind me about the Berlin meeting.",
      "expected_route": "memory",
      "category": "memory_recall",
      "notes": "meeting memory",
      "flags": {
        "memory_type": "episodic"
      }
    },
    {
      "id": "mem_013",
      "prompt": "What did we agree on about code review?",
      "expected_route": "memory",
      "category": "memory_recall",
      "notes": "agreement",
      "flags": {
        "memory_type": "episodic"
      }
    },
    {
      "id": "mem_014",
      "prompt": "Do you know my preferred programming language?",
      "expected_route": "memory",
      "category": "memory_recall",
      "notes": "preference",
      "flags": {
        "memory_type": "preference"
      }
    },
    {
      "id": "mem_015",
      "prompt": "Refresh my memory on my thesis topic.",
      "expected_route": "memory",
      "category": "memory_recall",
      "notes": "thesis",
      "flags": {
        "memory_type": "personal_fact"
      }
    },
    {
      "id": "mem_016",
      "prompt": "What notes did I share about the trip?",
      "expected_route": "memory",
      "category": "memory_recall",
      "notes": "trip notes",
      "flags": {
        "memory_type": "episodic"
      }
    },
    {
      "id": "mem_017",
      "prompt": "Remember what I said about my mom's name?",
      "expected_route": "memory",
      "category": "memory_recall",
      "notes": "explicit remember substring but recall read",
      "flags": {
        "memory_type": "relationship"
      }
    },
    {
      "id": "mem_018",
      "prompt": "Anything about me and vegetarian food?",
      "expected_route": "memory",
      "category": "memory_recall",
      "notes": "diet",
      "flags": {
        "memory_type": "preference"
      }
    },
    {
      "id": "rag_001",
      "prompt": "Summarize the attached PDF about quarterly revenue.",
      "expected_route": "rag",
      "category": "rag_retrieval",
      "notes": "doc summary"
    },
    {
      "id": "rag_002",
      "prompt": "According to my notes, what is the project deadline?",
      "expected_route": "rag",
      "category": "rag_retrieval",
      "notes": "notes lookup"
    },
    {
      "id": "rag_003",
      "prompt": "In my library, find mentions of confidentiality.",
      "expected_route": "rag",
      "category": "rag_retrieval",
      "notes": "library search"
    },
    {
      "id": "rag_004",
      "prompt": "What does the contract say about termination?",
      "expected_route": "rag",
      "category": "rag_retrieval",
      "notes": "contract"
    },
    {
      "id": "rag_005",
      "prompt": "Quote the safety section from the uploaded manual.",
      "expected_route": "rag",
      "category": "rag_retrieval",
      "notes": "manual"
    },
    {
      "id": "rag_006",
      "prompt": "Based on the file I uploaded, who are the authors?",
      "expected_route": "rag",
      "category": "rag_retrieval",
      "notes": "authorship"
    },
    {
      "id": "rag_007",
      "prompt": "Search my documents for Rayleigh scattering explanation.",
      "expected_route": "rag",